{"cases":[{"inputs":{"j":[1,2,3,4,5,6,7,8,9,10,11,12,13,14,15,16,17,18,19,20,21]},"outputs":{"names":["piston","tip","tilt","defocus","oblique astigmatism","vertical astigmatism","vertical coma","horizontal coma","vertical trefoil","oblique trefoil","primary spherical","Z(4,2)","Z(4,-2)","Z(4,4)","Z(4,-4)","Z(5,1)","Z(5,-1)","Z(5,3)","Z(5,-3)","Z(5,5)","Z(5,-5)"],"nm":[[0,0],[1,1],[1,-1],[2,0],[2,-2],[2,2],[3,-1],[3,1],[3,-3],[3,3],[4,0],[4,2],[4,-2],[4,4],[4,-4],[5,1],[5,-1],[5,3],[5,-3],[5,5],[5,-5]]}}],"engine_version":"0.02.000","function":"zernike.noll_to_nm","schema":"dinhot.engine-ref/v1","tolerance":{"abs":0.0,"rel":0.0}}
