{"cases":[{"inputs":{"v":{"complex":true,"data":[0.06911683841295721,0.16432362870023168,0.06608741523667742,-0.2606314463208722,0.18107117333462355,0.08927491447280227,-0.10739064707205703,0.11622362083927062,0.07291447923721515,0.0588264993311052,0.005684448263159358,0.1093425973224894],"shape":[6]},"weights":null},"outputs":{"efficiency":0.19063834569910967,"intensities":{"complex":false,"data":[0.03177939230141444,0.07229629726397473,0.04075678016690345,0.02504068111954565,0.008777078305986803,0.011988116541284602],"shape":[6]},"rel_std":66.62147681390496,"uniformity":0.21652184195569113,"weighted":{"complex":false,"data":[0.03177939230141444,0.07229629726397473,0.04075678016690345,0.02504068111954565,0.008777078305986803,0.011988116541284602],"shape":[6]}}},{"inputs":{"v":{"complex":true,"data":[0.037810676358706614,-0.10454968829614948,-0.0826127086783787,-0.48829347652797117,0.3599414765441804,0.22883317440744577,-0.06508456737356487,0.1547613173455323,0.05624213395952985,-0.11076456728481049,0.19551349022520714,-0.06211130933183051],"shape":[6]},"weights":[1.0,2.0,0.5,1.0,3.0,1.5]},"outputs":{"efficiency":0.5252405245324674,"intensities":{"complex":false,"data":[0.012360284569524873,0.24525537885495105,0.18192248824619323,0.02818706625672866,0.015431966998113014,0.04208333960695651],"shape":[6]},"rel_std":136.08829973640553,"uniformity":0.02788153294782425,"weighted":{"complex":false,"data":[0.012360284569524873,0.12262768942747553,0.36384497649238645,0.02818706625672866,0.005143988999371005,0.028055559737971008],"shape":[6]}}}],"engine_version":"0.02.000","function":"metrics.trap_metrics","schema":"dinhot.engine-ref/v1","tolerance":{"abs":1e-13,"rel":1e-12}}
