{"cases":[{"inputs":{"cost":{"complex":false,"data":[8.050029237453803],"shape":[1,1]}},"outputs":{"cols":[0],"total":8.050029237453803}},{"inputs":{"cost":{"complex":false,"data":[8.079407897364938,5.15325561042142,2.858013800881416,0.5393070238165643,3.8336888078551823,4.0847320541999865,0.45275193902445166,0.4875771072716806,9.991761150650714,6.523691115879878,2.3451020166982395,4.349475522251421,9.741861932592554,8.976776081085488,8.44231037608741],"shape":[3,5]}},"outputs":{"cols":[3,1,0],"total":3.3371609795392554}},{"inputs":{"cost":{"complex":false,"data":[3.924046643347782,4.9302301873174255,6.766893518310661,0.6080271295805606,5.555961169207234,2.714516045301015,8.796511733349222,0.6421443731219101,6.79181533021365,8.700885023275033,2.273185251609081,8.95448239414126,8.72195468024335,0.1851721767021075,7.074955673371774,0.011996835868286482,5.0336396555366445,4.366670521756527,2.0325283611456477,3.2494264457560607,8.062153310270435,3.164520874044902,1.4903858353355581,6.985119903183108,4.485441007603762],"shape":[5,5]}},"outputs":{"cols":[4,2,3,0,1],"total":9.55979542894444}},{"inputs":{"cost":{"complex":false,"data":[7.98939490963134,2.3551645730617143,3.197846543182863,7.998795260549533,5.070681389233913,5.06385001421571,2.361941283958635,0.1453628036381327,9.332239002254337,0.8582579108682997,8.4492680147361,3.6788073891151676,9.510229811957995,3.9942526157880645,9.36442061842003,5.561597755338971,2.4013532830277584,7.414216700278128,6.743897148867628,6.842052123845983,4.638243600833673,2.218885591644547,6.409401414813109,1.0708949613728647,6.922222746448298,6.353867998907107,3.765125255876922,7.985233458061055,1.9402547600704456,3.904589137977216,7.97933886097021,3.804753706433236,7.132578641244521,6.125178041653118,9.410009752426019,9.916767169901963,7.236762546507963,8.088438090346699,1.5286502314567285,7.128902625665684,8.476243802545339,4.012257479926315,5.53250039793541,4.794877517608621,9.585229997993714,3.1727784027671566,4.020845269377658,0.009197891108657652,4.201845346931305,6.3143610613229,9.349610941866503,9.236765847577345,3.2734981332409783,9.888610256190193],"shape":[6,9]}},"outputs":{"cols":[7,0,3,1,5,2],"total":9.184216437256397}},{"inputs":{"alpha":1.5,"atoms":{"complex":false,"data":[1.062620511987572,8.643755631011325,2.78696319034312,4.471233215743733,0.5725859671574873,0.027452064082378325,1.9515952159698624,3.416751841183406,9.281134210145737,8.897282885095475,4.805010166461464,4.547598185825813,6.669930438538807,8.587549024598541,3.3729750574869897,7.936545277586561,3.9898725308804384,5.940538823877074],"shape":[9,2]},"targets":{"complex":false,"data":[1.876749402345188,8.232520180360316,1.5725948708404458,4.050986528611595,0.7347331180727756,8.580389311980174,8.287980709765224,1.3978929854271627,5.271064765570825,2.581414969163064,4.917757000188362,5.532060059492489],"shape":[6,2]}},"outputs":{"assign":[7,3,0,5,1,8],"crossings":0}}],"engine_version":"0.02.000","function":"methods.assignment","schema":"dinhot.engine-ref/v1","tolerance":{"abs":1e-12,"rel":1e-12}}
