{"cases":[{"inputs":{"args":{"nx":4,"ny":3,"spacing_um":9.0},"generator":"square_grid"},"outputs":{"traps":{"charge":[0,0,0,0,0,0,0,0,0,0,0,0],"ids":[0,1,2,3,4,5,6,7,8,9,10,11],"weight":[1.0,1.0,1.0,1.0,1.0,1.0,1.0,1.0,1.0,1.0,1.0,1.0],"x_m":[-1.35e-05,-4.5e-06,4.5e-06,1.35e-05,-1.35e-05,-4.5e-06,4.5e-06,1.35e-05,-1.35e-05,-4.5e-06,4.5e-06,1.35e-05],"y_m":[-9e-06,-9e-06,-9e-06,-9e-06,0.0,0.0,0.0,0.0,9e-06,9e-06,9e-06,9e-06],"z_m":[0.0,0.0,0.0,0.0,0.0,0.0,0.0,0.0,0.0,0.0,0.0,0.0]}}},{"inputs":{"args":{"n":19,"spacing_um":8.0},"generator":"hex_lattice"},"outputs":{"traps":{"charge":[0,0,0,0,0,0,0,0,0,0,0,0,0,0,0,0,0,0,0],"ids":[0,1,2,3,4,5,6,7,8,9,10,11,12,13,14,15,16,17,18],"weight":[1.0,1.0,1.0,1.0,1.0,1.0,1.0,1.0,1.0,1.0,1.0,1.0,1.0,1.0,1.0,1.0,1.0,1.0,1.0],"x_m":[0.0,8e-06,4e-06,-4e-06,-8e-06,-4e-06,4e-06,1.2e-05,0.0,-1.2e-05,-1.2e-05,0.0,1.2e-05,1.6e-05,8e-06,-8e-06,-1.6e-05,-8e-06,8e-06],"y_m":[0.0,0.0,6.9282032302755086e-06,6.9282032302755086e-06,0.0,-6.9282032302755086e-06,-6.9282032302755086e-06,6.9282032302755086e-06,1.3856406460551017e-05,6.9282032302755086e-06,-6.9282032302755086e-06,-1.3856406460551017e-05,-6.9282032302755086e-06,0.0,1.3856406460551017e-05,1.3856406460551017e-05,0.0,-1.3856406460551017e-05,-1.3856406460551017e-05],"z_m":[0.0,0.0,0.0,0.0,0.0,0.0,0.0,0.0,0.0,0.0,0.0,0.0,0.0,0.0,0.0,0.0,0.0,0.0,0.0]}}},{"inputs":{"args":{"n":7,"radius_um":30.0},"generator":"ring"},"outputs":{"traps":{"charge":[0,0,0,0,0,0,0],"ids":[0,1,2,3,4,5,6],"weight":[1.0,1.0,1.0,1.0,1.0,1.0,1.0],"x_m":[2.9999999999999997e-05,1.8704694055762006e-05,-6.67562801868943e-06,-2.7029066037072567e-05,-2.702906603707257e-05,-6.675628018689437e-06,1.8704694055762e-05],"y_m":[0.0,2.3454944474040893e-05,2.9247837365454706e-05,1.3016512173526745e-05,-1.301651217352674e-05,-2.9247837365454706e-05,-2.3454944474040896e-05],"z_m":[0.0,0.0,0.0,0.0,0.0,0.0,0.0]}}},{"inputs":{"args":{"dz_um":25.0,"nx":2,"ny":3,"nz":2,"spacing_um":10.0},"generator":"lattice_3d"},"outputs":{"traps":{"charge":[0,0,0,0,0,0,0,0,0,0,0,0],"ids":[0,1,2,3,4,5,6,7,8,9,10,11],"weight":[1.0,1.0,1.0,1.0,1.0,1.0,1.0,1.0,1.0,1.0,1.0,1.0],"x_m":[-4.9999999999999996e-06,4.9999999999999996e-06,-4.9999999999999996e-06,4.9999999999999996e-06,-4.9999999999999996e-06,4.9999999999999996e-06,-4.9999999999999996e-06,4.9999999999999996e-06,-4.9999999999999996e-06,4.9999999999999996e-06,-4.9999999999999996e-06,4.9999999999999996e-06],"y_m":[-9.999999999999999e-06,-9.999999999999999e-06,0.0,0.0,9.999999999999999e-06,9.999999999999999e-06,-9.999999999999999e-06,-9.999999999999999e-06,0.0,0.0,9.999999999999999e-06,9.999999999999999e-06],"z_m":[-1.2499999999999999e-05,-1.2499999999999999e-05,-1.2499999999999999e-05,-1.2499999999999999e-05,-1.2499999999999999e-05,-1.2499999999999999e-05,1.2499999999999999e-05,1.2499999999999999e-05,1.2499999999999999e-05,1.2499999999999999e-05,1.2499999999999999e-05,1.2499999999999999e-05]}}},{"inputs":{"args":{"extent_um":120.0,"min_spacing_um":12.0,"n":12,"seed":11},"generator":"random_min_spacing"},"outputs":{"traps":{"charge":[0,0,0,0,0,0,0,0,0,0,0,0],"ids":[0,1,2,3,4,5,6,7,8,9,10,11],"weight":[1.0,1.0,1.0,1.0,1.0,1.0,1.0,1.0,1.0,1.0,1.0,1.0],"x_m":[-5.845241546630859e-06,5.8665189743041986e-05,3.569533824920654e-05,5.4933185577392575e-05,-2.96192193031311e-05,-5.954337358474731e-05,-1.5096874237060546e-05,-3.058872699737549e-05,4.241864204406738e-05,4.2528934478759764e-05,4.955466985702514e-05,-3.615697860717773e-05],"y_m":[3.6860096454620356e-05,-4.805231094360352e-07,-5.182531356811523e-05,3.491385698318481e-05,2.0366506576538083e-05,1.788680791854858e-05,-5.831612348556518e-05,4.791305065155029e-06,-4.98929500579834e-06,5.5364599227905266e-05,9.869971275329589e-06,-5.7282850742340085e-05],"z_m":[0.0,0.0,0.0,0.0,0.0,0.0,0.0,0.0,0.0,0.0,0.0,0.0]}}},{"inputs":{"generator":"snap_to_bins","setup":{"beam":"gaussian","focal_m":0.006,"n_imm":1.0,"n_pix":32,"na":0.5,"pad":2,"pitch_m":2e-05,"waist_frac":1.0,"wavelength_m":8.5e-07},"traps":{"charge":[0,0,0,0,0,0,0,0,0],"ids":[0,1,2,3,4,5,6,7,8],"weight":[1.0,1.0,1.0,1.0,1.0,1.0,1.0,1.0,1.0],"x_m":[-9.499999999999999e-06,0.0,9.499999999999999e-06,-9.499999999999999e-06,0.0,9.499999999999999e-06,-9.499999999999999e-06,0.0,9.499999999999999e-06],"y_m":[-9.499999999999999e-06,-9.499999999999999e-06,-9.499999999999999e-06,0.0,0.0,0.0,9.499999999999999e-06,9.499999999999999e-06,9.499999999999999e-06],"z_m":[0.0,0.0,0.0,0.0,0.0,0.0,0.0,0.0,0.0]}},"outputs":{"traps":{"charge":[0,0,0,0,0,0,0,0,0],"ids":[0,1,2,3,4,5,6,7,8],"weight":[1.0,1.0,1.0,1.0,1.0,1.0,1.0,1.0,1.0],"x_m":[-7.968749999999999e-06,0.0,7.968749999999999e-06,-7.968749999999999e-06,0.0,7.968749999999999e-06,-7.968749999999999e-06,0.0,7.968749999999999e-06],"y_m":[-7.968749999999999e-06,-7.968749999999999e-06,-7.968749999999999e-06,0.0,0.0,0.0,7.968749999999999e-06,7.968749999999999e-06,7.968749999999999e-06],"z_m":[0.0,0.0,0.0,0.0,0.0,0.0,0.0,0.0,0.0]}}},{"inputs":{"generator":"check_in_field","setup":{"beam":"gaussian","focal_m":0.006,"n_imm":1.0,"n_pix":32,"na":0.5,"pad":2,"pitch_m":2e-05,"waist_frac":1.0,"wavelength_m":8.5e-07},"traps":{"charge":[0,0,0],"ids":[0,5,6],"weight":[1.0,1.0,1.0],"x_m":[1e-05,0.0,0.0002],"y_m":[0.0,-0.00019124999999999996,0.0],"z_m":[0.0,0.0,0.0]}},"outputs":{"error":{"axis":"y","bound_m":0.00012749999999999998,"message":"trap 5 has y = -1.912e-04 m, outside the unaliased field of view (bound = 1.275e-04 m = lambda f / (2 p))","trap_id":5,"value_m":-0.00019124999999999996}}}],"engine_version":"0.02.000","function":"traps.generators","schema":"dinhot.engine-ref/v1","tolerance":{"abs":1e-12,"rel":1e-12}}
