{"cases":[{"inputs":{"seed":0},"outputs":{"normal":[1.0361578093672241,0.06826620106064285,1.0565317653105397,-0.8078539351599537,0.35871758417304217,0.6979907783414204,-1.0539115347405241,0.2387691617644319,1.930530997819039,0.05414500779047338,1.005638386805872,0.07136362639645343,-1.0357432063437293,-1.7610098790836302,0.9786988401700222,-2.5177268987005235,-1.2830854483163339],"phases":[2.6185258028073455,0.06578890064606807,3.6885826388325302,5.630387723768541,1.6652747128503316,1.0960678471682048,2.7788286676765366,2.9187984224586487,5.309886106984024],"u32":[1789933344,44971166,2521387044,3848737593,1138324114,749234105,1899511038,1995189375,3629653958,19166872,1711213692,48427069,3762117657,2857799264,4183157539,3474655728,2935884904,2532138043,3029317084,4067376433,104419867,2288059600,432411185,3144029424,2641579280,2902280130,1507677558,3252731978,608271622,862454811,1549925450,3381777965],"uniform":[0.41675132513046265,0.01047062873840332,0.5870561599731445,0.8961040377616882,0.2650367021560669,0.17444461584091187,0.4422643184661865,0.4645411968231201,0.845094621181488,0.004462599754333496,0.3984229564666748,0.011275291442871094,0.8759362697601318,0.6653832197189331,0.9739672541618347,0.8090062737464905]}},{"inputs":{"seed":1},"outputs":{"normal":[-0.43792993487693704,-0.01706232464561257,-2.086604602624114,0.16744965261981457,-1.0662226660344072,-0.04946136440771179,-0.8390927504942391,-1.4293056031399274,0.13318726033890388,-0.5110535115402308,-2.24974200314121,0.743042425212936,1.8246634985523997,1.6326303530593305,1.2401944722072993,-0.7470173613987994,0.649640261684226],"phases":[0.5753480319320656,3.1805342688986644,5.580679780410319,3.0615144372792287,2.7285997850419608,3.1879487590447972,4.692155489167137,4.181536128484043,0.8178810304963889],"u32":[393288148,2174103013,3814759091,2092745082,1865176206,2179171167,3207394750,2858353069,559075315,3395495274,4035540825,1929427096,4080585408,498941776,2789075627,3924381082,891783897,212198729,2051990826,3015381799,1303255859,723616818,2707487543,1195870907,1493934442,1990658952,3126471170,464135096,2692946770,784784495,3641130122,3172118176],"uniform":[0.09156948328018188,0.5061977505683899,0.8881927728652954,0.48725515604019165,0.43427014350891113,0.5073778033256531,0.74677973985672,0.6655121445655823,0.1301698088645935,0.7905753254890442,0.9395975470542908,0.44922971725463867,0.9500852823257446,0.11616891622543335,0.6493822336196899,0.9137161374092102]}},{"inputs":{"seed":7},"outputs":{"normal":[0.1604118692217061,0.273442084500182,2.2017943384212715,-0.6829581958893687,-0.6445044934926117,-0.7727061367885713,0.6699555534088111,0.5323804875291923,-0.3482402247413952,-1.4212323308937809,0.8482704118369557,0.06446820776431125,-0.2237298856566507,0.28881672816216014,-0.6681294153384397,0.07623349601237178,-1.104986240807587],"phases":[0.30793615697125026,1.0402588098120724,5.842439969807175,5.982413095152541,2.495910703716303,4.017205815032596,1.926365658187628,0.6714705038417044,4.129262437474991],"u32":[210494603,711084892,3993689120,4089369890,1706118055,2746022466,1316796690,458993998,2822620451,3056969920,1304036932,51851013,277270279,1524271095,869151309,2069824935,2026515438,2291319099,1867110331,3240512688,2678417139,3649812394,143050505,3707213540,12143489,2875310095,2393872773,2074695330,767287126,1406403338,3000431021,897123418],"uniform":[0.04900956153869629,0.16556233167648315,0.9298532009124756,0.9521306157112122,0.39723652601242065,0.6393581628799438,0.30659061670303345,0.10686784982681274,0.6571925282478333,0.7117562294006348,0.30361974239349365,0.012072503566741943,0.0645570158958435,0.3548969626426697,0.20236504077911377,0.4819186329841614]}},{"inputs":{"seed":20261028},"outputs":{"normal":[0.7308209383969814,0.2238880450662195,-0.7305434624372357,0.05981567621204211,-0.23721586941928957,0.04905227173732147,-1.4380293497246348,1.2634164660963416,-0.6046150188581855,-0.17981536320861263,1.7220619860412858,1.924540280300576,-0.962962331915844,0.617235791698835,-1.6817551220026006,1.035000588628579,-1.0616449856250498],"phases":[1.591628280243661,0.29727356736873756,1.480182853271439,3.0598965669170055,0.1816628732278476,2.937683313867321,5.277366163689282,2.4207415255325953,1.1335256656309816],"u32":[1087982062,203206091,1011801836,2091639084,124178443,2008098494,3607424364,1654735072,774838870,2345084781,4141954335,574787224,2062057447,1757848060,3683760229,1770369725,3652242284,2827481398,4283243442,3461764069,1164279370,2229733400,3931493222,723334076,3329520830,3586223767,4261312404,4024843179,1436790946,329898350,2758559266,799587011],"uniform":[0.2533155083656311,0.04731255769729614,0.23557841777801514,0.48699766397476196,0.02891254425048828,0.46754682064056396,0.8399189114570618,0.3852729797363281,0.18040621280670166,0.5460075736045837,0.9643738865852356,0.1338280439376831,0.4801101088523865,0.40928083658218384,0.8576922416687012,0.4121962785720825]}},{"inputs":{"seed":4294967295},"outputs":{"normal":[-2.224459850388015,1.1313899896120576,-0.7249615094923938,-0.31482865714092395,1.2417435902147202,1.5369246015598765,-1.5479579431065058,2.1328676425583444,0.2123863439066506,0.6539877884486125,1.8078148623287706,0.6027035895966986,0.5989183406189157,2.716971368576255,0.14784732575309764,-0.7164521414379836,-0.3319181479805332],"phases":[6.004104916738265,2.671078127045447,1.6855875995578828,3.5512883622605393,5.391065748464796,0.8912323515647653,6.088188485716416,2.198604928743132,1.3228513271647198],"u32":[4104197751,1825856343,1152209388,2427537429,3685145430,609215610,4161674276,1502890106,904255344,859094872,3596089546,219971322,4205410045,925431481,1008337578,3360333762,440704714,1616628565,4111429727,1070591580,3670177132,751451199,1154266850,708695893,707288033,2849050825,1922738128,2819339503,2982418223,2175478147,3300895900,2449143093],"uniform":[0.9555829763412476,0.42511528730392456,0.2682695984840393,0.5652050971984863,0.8580147624015808,0.1418440341949463,0.9689652919769287,0.34991884231567383,0.2105383276939392,0.2000235915184021,0.8372797966003418,0.0512160062789917,0.979148268699646,0.21546876430511475,0.23477184772491455,0.7823886275291443]}}],"engine_version":"0.02.000","function":"rng.stream","schema":"dinhot.engine-ref/v1","tolerance":{"abs":1e-14,"rel":1e-14}}
